{
  "contract": "ai_daily_context",
  "protocol_version": 1,
  "request_id": "41111111-4111-4111-8111-411111111111",
  "scan_run_id": 7,
  "context_run_id": 9,
  "status": "ok",
  "run_status": "success",
  "summary": {
    "source_file_count": 1,
    "success_count": 1,
    "timeout_count": 0,
    "included_file_count": 1,
    "omitted_file_count": 0,
    "error_file_count": 0,
    "input_chars": 32,
    "output_chars": 32,
    "total_duration_ms": 26,
    "discovery_duration_ms": 2,
    "parse_duration_ms": 18,
    "compression_duration_ms": 1
  },
  "stage_metrics": [
    {
      "stage": "discovery",
      "item_count": 1,
      "duration_ms": 2
    },
    {
      "stage": "cache",
      "item_count": 1,
      "duration_ms": 1
    },
    {
      "stage": "parse",
      "item_count": 1,
      "duration_ms": 18
    },
    {
      "stage": "context",
      "item_count": 1,
      "duration_ms": 1
    }
  ],
  "extension_metrics": [
    {
      "extension": ".xlsx",
      "file_count": 1,
      "parse_duration_ms": 18,
      "success_count": 1,
      "error_count": 0,
      "timeout_count": 0
    }
  ],
  "files": [
    {
      "relative_path": "工作 目录\\sample.xlsx",
      "file_identity": "bootstrap:c:\\scanner-fixtures\\工作 目录\\sample.xlsx",
      "source_version": "mtime_ns=2000000000:size=8192",
      "parse_status": "success",
      "parser_backend": "rust_xlsx_bounded_v2",
      "worker_lane": "rust_office_process_v2",
      "cache_status": "miss",
      "cache_miss_reason": "new_file",
      "truncated": false,
      "content_sha256": "e68e5f82d38d424525fb4a925c806e10d27cf5385dbd1daa3a2b0c6ac6528de7",
      "parse_duration_ms": 18,
      "failure_class": "",
      "fallback_backend": "",
      "fallback_reason_code": ""
    }
  ],
  "decisions": [
    {
      "relative_path": "工作 目录\\sample.xlsx",
      "action": "keep",
      "reason": "fits_per_file_and_global_budget",
      "priority": 100,
      "input_chars": 32,
      "output_chars": 32,
      "truncated": false,
      "error_code": ""
    }
  ],
  "warnings": [],
  "error": null
}
